input,output
"आफ्ना-आफ्ना नामजा, पोका कसैले आफ्ना पोल्टा छामे।","आफ्ना-आफ्ना नाम्‌जा, पोका कसैले आफ्ना पोल्टा छामे।"
केटीहरू सबै एकै ठाउँमा भेला भए।,केटीहरू सबै एकै ठाउँमा भेला भए।
"ती गफ गर्दै, खाजा साटासाट गर्दै, हाँस्दै खान लागे।","ती गफ् गर्दै, खाजा साटासाट् गर्दै, हाँस्दै खान लागे।"
"नुमा नानाले सेल रोटी बोकेकी थिई खाउँ भन्थी, मास्तिरै खाएकी।","नुमा नानाले सेल् रोटी बोकेकी थिई खाउँ भन्थी, मास्तिरै खाएकी।"
के भयो बिर्खे दाजुलाई?,के भयो बिर्खे दाजुलाई?
"ख्वाप्पै पारेछ, केले हो?","ख्वाप्पै पारेछ, केले हो?"
ओडारमा रैछ।,ओडार्‌मा रैछ।
अब भो खोइ कान्छीमा अनि नुमा?,अब भो खोइ कान्छीमा अनि नुमा?
गाउँमा हल्‍लै भयो- नुमाले भालु मारी।,गाउँमा हल्‍लै भयो- नुमाले भालु मारी।
बिर्खे उम्कियो नत्र भालुले बिर्खेलाई खाने थियो।,बिर्खे उम्कियो नत्र भालुले बिर्खेलाई खाने थियो।
जसले पनि बिर्खेलाई भेट्थ्‍यो त्यही कुरा सोध्थ्यो।,जस्‌ले पनि बिर्खेलाई भेट्थ्‍यो त्यही कुरा सोध्थ्यो।
के तँलाई भालुले खायो?,के तँलाई भालुले खायो?
कसरी उम्‌किस्?,कसरी उम्‌किस्?
नुमाले तँलाई खाने भालु मार्‍यो रे।,नुमाले तँलाई खाने भालु मार्‍यो रे।
धनलालले माधे सङ्‍क्रान्तिमा मामाको घरमा आउँदा कोसीमा गुँजले बिर्खेलाई पक्रेको कुरा पनि गरेको थियो।,धन्‌लाल्‌ले माधे सङ्‍क्रान्तिमा मामाको घर्‌मा आउँदा कोसीमा गुँज्‌ले बिर्खेलाई पक्रेको कुरा पनि गरेको थियो।
त्यहाँ पनि नुमाले गुँजलाई खुर्पाले काटेर बिर्खेलाई बचाएकी थिई।,त्यहाँ पनि नुमाले गुँज्‌लाई खुर्पाले काटेर बिर्खेलाई बचाएकी थिई।
चिम्रीले पनि मौरी काड्न नसकेको अनि नुमाले बाँसको लिङ्‍गोबाट चढेर मह झिकेको कुरा गाउँमा गरेकी थिई।,चिम्रीले पनि मौरी काड्न नसकेको अनि नुमाले बाँस्‌को लिङ्‍गोबाट चढेर मह झिकेको कुरा गाउँमा गरेकी थिई।
"सबै-सबैले सोध्ने, बिर्खेलाई खपिसक्नु भएन।","सबै-सबैले सोध्ने, बिर्खेलाई खपिसक्नु भएन।"
उसले आफुलाई होचिएको ठान्‍न लाग्यो।,उस्‌ले आफुलाई होचिएको ठान्‍न लाग्यो।
कहिले कहीँ केटीहरूले पनि जिस्काउने।,कहिले कहीँ केटीहरूले पनि जिस्काउने।
"उसको नुमासाई पन्साउनु पाए त्यो घोच, पेच, व्यङ्‍ग पनि पन्सिने सम्झ्यो।","उस्‌को नुमासाई पन्साउनु पाए त्यो घोच्, पेच्, व्यङ्‍ग पनि पन्सिने सम्झ्यो।"
उसले उपाय रच्‍यो खोलामा बगाउनु।,उस्‌ले उपाय् रच्‍यो खोलामा बगाउनु ।
ऊ चङ्‍खी छ।,ऊ चङ्‍खी छ।
जङ्‍गली जन्तुसित ऊ डराउँदैन।,जङ्‍गली जन्तुसित ऊ डराउँदैन।
बल पनि कस्तो अनि उसले बोकेको भारी उचाल्नै सकिन्दैन।,बल् पनि कस्तो अनि उस्‌ले बोकेको भारी उचाल्नै सकिन्दैन।
"बैसाख लाग्ने बेला फुल्न लागेको बेला, फुलमा मौरीहरू, पुतलीहरू उडिरहेका थिए।","बैसाख् लाग्ने बेला फुल्न लागेको बेला, फुल्‌मा मौरीहरू, पुतलीहरू उडिरहेका थिए।"
घाम लागेको दिन गाउँका केटाहरू बन तरूल खन्‍न जाने भए।।,घाम् लागेको दिन् गाउँका केटाहरू बन् तरूल् खन्‍न जाने भए।।
गाउँले जीवननै यस्तो हुन्छ।,गाउँले जीवन्‌नै यस्तो हुन्छ।
मनोरञ्‍जनसँग-सँगै जीवनोपयोगी काम पनि हुँदछ।,मनोरञ्‍जन्‌सँग-सँगै जीवनोपयोगी काम् पनि हुँदछ।
परिश्रम- मनोरञ्‍जन दुवै यिनीहरू एकै साथ पाउँछन्।,परिश्रम्- मनोरञ्‍जन् दुवै यिनीहरू एकै साथ् पाउँछन्।
निरन्तरको अन्तर यसरी यी छुटाउँछन् अनि जीवनमा रस भर्छन्।,निरन्तर्‌को अन्तर् यसरी यी छुटाउँछन् अनि जीवन्‌मा रस् भर्छन्।
"पहिले त्यो सड़कमा धूलो उड्‌थियो, अहिले अलकत्रा छापिएको छ।","पहिले त्यो सड़क्‌मा धूलो उड्‌थियो, अहिले अलकत्रा छापिएको छ।"
यसका दुईतिर बजार बसेको छ।,यस्‌का दुईतिर बजार् बसेको छ।
त्यस बेला पनि थियो।,त्यस् बेला पनि थियो।
"हिजो आज प्रशस्त गाड़ीहरू आउँछन्, उस बेला पनि आउँथे तर थोरै।","हिजो आज प्रशस्त गाड़ीहरू आउँछन्, उस् बेला पनि आउँथे तर थोरै।"
"यो बजार मास्तिर अस्पताल छ,  उस बेला पनि थियो।","यो बजार् मास्तिर अस्पताल् छ,  उस् बेला पनि थियो।"
थाना पनि त्यसै छ।,थाना पनि त्यसै छ।
त्यस बेला पनि त्यो थाना थियो।,त्यस् बेला पनि त्यो थाना थियो।
त्यसैको छेउबाट एउटा गाउँले सडक उँभो जान्छ।,त्यसैको छेउबाट एउटा गाउँले सडक् उँभो जान्छ।
गाडी चल्छ तर त्यो बेला घोडा मात्र यहाँ हिँड्थ्यो,गाडी चल्छ तर त्यो बेला घोडा मात्र यहाँ हिँड्थ्यो
मानिसहरू प्रायः घुम्ती बाटो भनेर उति हिँड्दैन थिए।,मानिस्‌हरू प्रायः घुम्ती बाटो भनेर उति हिँड्दैन थिए।
तीन माइम माथिसम्म फराकिलो सडक पुग्छ।,तीन् माइम् माथिसम्म फराकिलो सडक् पुग्छ।
त्यहाँदेखि यो टुँगिन्दै जान्छ अनि गाउँ पातलन्दै आउँछ अनि जङ्‍गल देखा पर्छ।,त्यहाँदेखि यो टुँगिन्दै जान्छ अनि गाउँ पात्‌लन्दै आउँछ अनि जङ्‍गल् देखा पर्छ।
ठाउँ पनि भिरालो भिरालो छ।,ठाउँ पनि भिरालो भिरालो छ।
त्यही भीरतिर प्रशस्तै रुख-पातहरू छन्।,त्यही भीर्‌तिर प्रशस्तै रुख्-पात्‌हरू छन्।
यताकाहरू जङ्‍गल नजिक भएको हुनाले गाई-बस्तु पाल्छन्।,यताकाहरू जङ्‍गल् नजिक् भएको हुनाले गाई-बस्तु पाल्छन्।
दुध घिउको चलन गर्छन्।,दुध् घिउको चलन् गर्छन्।
यहीँ एउटा टाँडे घर छ।,यहीँ एउटा टाँडे घर् छ।
छानो खरले छाएको भए पनि मनिल्‍लो तला गारोको छ।,छानो खर्‌ले छाएको भए पनि मनिल्‍लो तला गारोको छ।
माथिल्‍लो तला गारोको छ।,माथिल्‍लो तला गारोको छ।
माथिल्‍लो तला तखतीले बारेको छ।,माथिल्‍लो तला तख्‌तीले बारेको छ।
पहिले मनिल्‍सा तलामा गाई-बाछाहरूको थलो थियो।,पहिले मनिल्‍सा तलामा गाई-बाछाहरूको थलो थियो।
"पछि लामखुट्‍टे, भुसुना लाग्दा, गाई-बाछाहरू सारेर गारो लगाएको हो।","पछि लाम्‌खुट्‍टे, भुसुना लाग्दा, गाई-बाछाहरू सारेर गारो लगाएको हो।"
यहीँ आमा अनि मानाहाँग सुत्छन्।,यहीँ आमा अनि मानाहाँग् सुत्छन्।
यो घर छिरिङ लेन्डुपको हो।,यो घर् छिरिङ् लेन्डुप्‌को हो।
ऊ भोटे बाबु अनि राइनी आमाको छोरो हो।,ऊ भोटे बाबु अनि राइनी आमाको छोरो हो।
उसकी एक जना बहिनी छ।,उस्‌की एक् जना बहिनी छ।
"लापचेनी जहान छ जहान राम्री छ, फसाइली छ अनि चोखो मन भएकी छ।","लाप्‌चेनी जहान् छ जहान् राम्री छ, फसाइली छ अनि चोखो मन् भएकी छ।"
तिम्रोमा बेच्ने गोरु छ?,तिम्रोमा बेच्ने गोरु छ?
छिलेन्डुपको गाई-गोरुहरूको गोठ जङ्‍गलभित्र थियो।,छिलेन्डुप्‌को गाई-गोरुहरूको गोठ् जङ्‍गल्‌भित्र थियो।
उसको बोलाउने नाउँ त्यहीँ।,उस्‌को बोलाउने नाउँ त्यहीँ।
आमाले पनि त्यही नाउँले डाकछिन्।,आमाले पनि त्यही नाउँले डाक्‌छिन्।
"साथी-भाइहरूले पनि त्यसरी नै डाक्छन्, बोलाउँछन्।","साथी-भाइहरूले पनि त्यसरी नै डाक्छन्, बोलाउँछन्।"
"मान्छे गतिलो छ, बलियो छ, आँटिलो छ तर सिधा छ।","मान्छे गतिलो छ, बलियो छ, आँटिलो छ तर सिधा छ।"
उसँग  मानाहाँग बस्छ।,उसँग  मानाहाँग् बस्छ।
उसले माने भन्छ उसलाई- आमाको भदै हो।,उस्‌ले माने भन्छ उस्‌लाई- आमाको भदै हो।
"पाँच माऊ लैना गाईहरू छन् तीन माऊ थाक्न लागेका, तीन माऊ बियाउने, पाँचवटी कोरोलाहरू छन्।","पाँच् माऊ लैना गाईहरू छन् तीन् माऊ थाक्न लागेका, तीन् माऊ बियाउने, पाँच्‌वटी कोरोलाहरू छन्।"
बहर बाछोहरू पनि छन् अर्थात् गोठ भरिभराऊ छ।,बहर् बाछोहरू पनि छन् अर्थात् गोठ् भरिभराऊ छ।
"लौबहादुर, लौके भन्छन् नि उसलाई, आफ्नै गाउँको गोरु किन्‍न आएछ।","लौबहादुर्, लौके भन्छन् नि उस्‌लाई, आफ्नै गाउँको गोरु किन्‍न आएछ।"
उसले कालो र दार्ने दुई बर्खे एक हल बाछाहरू मन परायो।,उस्‌ले कालो र दार्ने दुई बर्खे एक् हल् बाछाहरू मन् परायो।
के लान्छ त्यो दुधे बाछाहरू।,के लान्छ त्यो दुधे बाछाहरू।
यही मन पर्‍यो मलाई।,यही मन् पर्‍यो मलाई।
"ऊ त्यो हेर्न, पुँडे तीन बर्खे।","ऊ त्यो हेर्न, पुँडे तीन् बर्खे।"
अहिले नै काम दिन्छ।,अहिले नै काम् दिन्छ।
लौबहादुर आकर्षित भयो।,लौबहादुर् आकर्षित् भयो।
मानाहाँग घाँसको भारी बिसाएर गाईको थला सफा गर्न  लाग्यो।,मानाहाँग् घाँस्‌को भारी बिसाएर गाईको थला सफा गर्न लाग्यो।
उसले गाउँबाट ल्याएको सानु छाउरा उसको अघिपछि खेल्दै थियो।,उस्‌ले गाउँबाट ल्याएको सानु छाउरा उस्‌को अघिपछि खेल्दै थियो।
"तिल्कु गाईको पछि पुग्यो, त्यो दुर्छी गाईले लातले हानिदियो।","तिल्कु गाईको पछि पुग्यो, त्यो दुर्छी गाईले लात्‌ले हानिदियो।"
छाउरोलाई लाग्यो।,छाउरोलाई लाग्यो।
"त्यो कुइँकुइँ गर्दै भाग्यो, मानाहाँग् हाँस्यो।","त्यो कुइँकुइँ गर्दै भाग्यो, मानाहाँग् हाँस्यो।"
"सुन त मानाहाँग, म घर जान्छु फुपू- आमा बिरामी छ कि, दवाई दिनुपर्छ।","सुन त मानाहाँग्, म घर् जान्छु फुपू- आमा बिरामी छ कि, दवाई दिनुपर्छ।"
"हेर्छु साह्रै छ भने डाक्टर देखाउनु पर्छ, लान्छु।","हेर्छु साह्रै छ भने डाक्टर् देखाउनु पर्छ, लान्छु।"
बेलुका ढीलो भएँ भने गाई- बाछा लाउनु।,बेलुका ढीलो भएँ भने गाई- बाछा लाउनु।
"टिल्कु त्यो होस्, अबेर भए पनि मै आएर दुहुन्छु।","टिल्कु त्यो होस्, अबेर् भए पनि मै आएर दुहुन्छु।"
"हुन्छ, घिउ छुर्पीहरू लानु?","हुन्छ, घिउ छुर्पीहरू लानु?"
"घिउहरू लानुपर्छ, भोलि हो हाट, उता उतै चलाइराख्नु पर्छ।","घिउहरू लानुपर्छ, भोलि हो हाट्, उता उतै चलाइराख्नु पर्छ।"
उतै बस्ने आज?,उतै बस्ने आज?
"होइन, आउँछु।","होइन, आउँछु।"
"पाकेको केरा पठाइदिनु है भाउज्यु, सुन्तला पनि ल।","पाकेको केरा पठाइदिनु है भाउज्यु, सुन्तला पनि ल।"
यो अन्य काष्ठ कौशल अन्तर्गत पर्ने वस्तुहरू भन्दा पुरानो र अप्राप्त वस्तु हो।,यो अन्य काष्ठ कौशल् अन्तर्गत् पर्ने वस्तुहरू भन्दा पुरानो र अप्राप्त वस्तु हो।
सिङ्‍गमाङ्‍गको नाम सुन्‍नेहरू सबैले यो वस्तु देखेका छन् भन्‍न सकिन्छ।,सिङ्‍ग्‌माङ्‍ग्‌को नाम् सुन्‍नेहरू सबैले यो वस्तु देखेका छन् भन्‍न सकिन्छ।
सिङ्‍गमाङ्‍गमा घिउ नै राखिन्थ्यो भन्‍ने कुरा सासु र बुहारीका चर्का-चर्कीका निम्न प्रस्तुत कवितांशले व्यक्‍त गर्दछ।,सिङ्‍ग्‌माङ्‍ग्‌मा घिउ नै राखिन्थ्यो भन्‍ने कुरा सासु र बुहारीका चर्का-चर्कीका निम्न प्रस्तुत कवितांशले व्यक्‍त गर्दछ।
सासु भन्छे बुहारी!,सासु भन्छे बुहारी!
बुहारी भन्छे ज्यू!,बुहारी भन्छे ज्यू!
सिङ्‍गमाङ्‍गमा राखेको,सिङ्‍ग्‌माङ्‍ग्‌मा राखेको
कसले खायो घिउ?,कस्‌ले खायो घिउ?
देख्नु न सुन्‍नु,देख्नु न सुन्‍नु
कैले मैले खाएँ?,कैले मैले खाएँ?
ओँठ तेरा चिल्‍ला छन्,ओँठ् तेरा चिल्‍ला छन्
चाल मैले पाएँ।,चाल् मैले पाएँ।
सिङ्‍गमाङ्‍ग काष्ठ कौशल भित्र पर्ने अन्य सामग्री जस्तै चुदारेहरूले मेहनत गरी खिपेर बनाएको वस्तु हो।,सिङ्‍ग्‌माङ्‍ग् काष्ठ कौशल् भित्र पर्ने अन्य सामग्री जस्तै चुदारेहरूले मेहनत् गरी खिपेर बनाएको वस्तु हो।
"भुइँमा राख्दा ठ्याप्प गरी बस्ने, बिर्को ट्याप्प मिल्ने गरी बनाइएको हुन्छ।","भुइँमा राख्दा ठ्याप्प गरी बस्ने, बिर्को ट्याप्प मिल्ने गरी बनाइएको हुन्छ।"
बिर्को उघारेर हेर्दा भर्खंरै पारेको नौनी घिउले भरेर राख्दा खुबै सुहाउने वस्तु देखिन्छ।,बिर्को उघारेर हेर्दा भर्खंरै पारेको नौनी घिउले भरेर राख्दा खुबै सुहाउने वस्तु देखिन्छ।
यस्ता कौशलागत सामग्रीलाई पाउन आज परेको कठिनाईलाई हेर्दा जोगाएर राख्न पर्छ।,यस्ता कौशलागत् सामग्रीलाई पाउन आज परेको कठिनाईलाई हेर्दा जोगाएर राख्न पर्छ।
नत्र यस्ता महान् र पौराणिक वस्तुहरूको नामसम्म हराउने अड्कल सहजै लाउन सकिन्छ।,नत्र यस्ता महान् र पौराणिक् वस्तुहरूको नाम्‌सम्म हराउने अड्कल् सहजै लाउन सकिन्छ।
काठलाई तला-तला पारी जोडेर चलाउन सकिने वस्तु गुप्ते हो।,काठ्‌लाई तला-तला पारी जोडेर चलाउन सकिने वस्तु गुप्ते हो।
"गुप्तेको फेद तलामा भित्रिपट्‌टि एउटा सानो बट्‌टा आकारको, ढकनी हुन्छ।","गुप्तेको फेद् तलामा भित्रिपट्‌टि एउटा सानो बट्‌टा आकार्‌को, ढकनी हुन्छ।"
भित्री बट्‍‌टामा बिर्को भएको कारण मूल्य वस्तुहरूलाई लुकाएर राख्ने गरिन्थ्यो।,भित्री बट्‍‌टामा बिर्को भएको कारण् मूल्य वस्तुहरूलाई लुकाएर राख्ने गरिन्थ्यो।
ढकनी लगाइसके पछि माथिबाट घिउ जस्ता कुराले गुप्ते भरेर राख्थे।,ढकनी लगाइसके पछि माथिबाट घिउ जस्ता कुराले गुप्ते भरेर राख्थे।
