input,output
"सायद भाषा, साहित्य तथा वाङ्मयका अन्य क्षेत्रमा काम गर्ने सबैमा यस्तो इच्छा हुन्छ ।","सायद् भाषा, साहित्य तथा वाङ्मयका अन्य क्षेत्रमा काम् गर्ने सबैमा यस्तो इच्छा हुन्छ ।"
आयल निगमको कार्यकारीमा क–कसको नजर छ?,आयल् निगम्‌को कार्यकारीमा क–कस्‌को नजर् छ?
उनीहरूलाई खान र बाँच्नकै लागि समस्या हुन्छ ।’,उनीहरूलाई खान र बाँच्नकै लागि समस्या हुन्छ ।’
आइसिआईले अन्तर्वार्ता लिँदा ती नागरिकसँग केही कागजात हुँदैन ।,आइसिआईले अन्तर्वार्ता लिँदा ती नागरिक्‌सँग केही काग्‌जात् हुँदैन ।
‘उसले नेपाली हुँ भनेको भरमा आइसिआईले सानो नोट दिएर पठाएको हुन्छ ।,‘उस्‌ले नेपाली हुँ भनेको भर्‌मा आइसिआईले सानो नोट दिएर पठाएको हुन्छ ।
उनीहरूले काम गर्न पाउँदैनन् ।,उनीहरूले काम् गर्न पाउँदैनन् ।
पासपोर्ट आइपुग्न तीन-चार महिना लाग्छ ।,पासपोर्ट् आइपुग्न तीन्-चार् महिना लाग्छ ।
त्यसपछि मात्रै उनीहरूले ‘वर्क परमिट’ पाउँछन् ।,त्यस्‌पछि मात्रै उनीहरूले ‘वर्क् परमिट्’ पाउँछन् ।
फेसबुकले आफ्नो छुट्टै भिडियो स्ट्रिमिङ्ग सर्भिस सार्वजनिक गर्ने भएको छ ।,फेस्‌बुक्‌ले आफ्नो छुट्टै भिडियो स्ट्रिमिङ्ग् सर्भिस् सार्वजनिक् गर्ने भएको छ ।
यो सेवा अमेरिकी प्रयोगकर्ताका लागि एक वर्षदेखि उपलब्ध हुँदै आएको छ ।,यो सेवा अमेरिकी प्रयोग्‌कर्ताका लागि एक् वर्षदेखि उपलब्ध हुँदै आएको छ ।
यो नयाँ सेवामा प्रयोगकर्ताले आफूलाई मनपर्ने शो छनोट गर्न सक्छन् ।,यो नयाँ सेवामा प्रयोग्‌कर्ताले आफूलाई मन्‌पर्ने शो छनोट् गर्न सक्छन् ।
जसमा चर्चित ब्राण्डदेखि नयाँ खेलाडिसम्मको शो देख्न सकिनेछ ।,जस्‌मा चर्चित् ब्राण्ड्‌देखि नयाँ खेलाडिसम्मको शो देख्न सकिनेछ ।
यसका साथै न्यूज फिडमा सेभ गरिएका स–साना भिडियोहरु पनि हेर्न सकिन्छ ।,यस्‌का साथै न्यूज् फिड्‌मा सेभ् गरिएका स–साना भिडियोहरु पनि हेर्न सकिन्छ ।
धेरै पटक हेरिएको भिडियोमा युट्युबमा जस्तै विज्ञापन पनि देखिनेछ ।,धेरै पटक् हेरिएको भिडियोमा युट्युब्‌मा जस्तै विज्ञापन् पनि देखिनेछ ।
भिडियोबाट हुने फाइदा भिडियो अपलोड गर्ने प्रयोगकर्ता र फेसबुकले बाँड्नेछन् ।,भिडियोबाट हुने फाइदा भिडियो अप्‌लोड् गर्ने प्रयोग्‌कर्ता र फेस्‌बुक्‌ले बाँड्नेछन् ।
यस कारण केही प्रयोगकर्ताले उक्त पेज देख्न पाएनन् ।,यस् कारण् केही प्रयोग्‌कर्ताले उक्त पेज् देख्न पाएनन् ।
प्रयोगकर्ताले कुनै कुनै शोहरु धेरैपटक पनि हेर्ने गरेका छन् ।,प्रयोग्‌कर्ताले कुनै कुनै शोहरु धेरैपटक् पनि हेर्ने गरेका छन् ।
उनले टक शो ‘रेड टेबल टक’ उत्पादनमा काम गरिरहेका छन् ।,उन्‌ले टक् शो ‘रेड् टेबल् टक्’ उत्पादन्‌मा काम् गरिरहेका छन् ।
उनी ‘सरी फर योर लस’ मा देखा पर्नेछिन् ।,उनी ‘सरी फर् योर् लस्’ मा देखा पर्नेछिन् ।
यो नाटकको अर्को महिना प्रिमियर गरिनेछ ।,यो नाटक्‌को अर्को महिना प्रिमियर् गरिनेछ ।
यो पनि पढ्नुहोस्।,यो पनि पढ्नुहोस्।
सुनको भाउ घट्यो।,सुन्‌को भाउ घट्यो।
महिला विश्वकपमा इंग्ल्याण्डले बंगलादेशलाई हरायो।,महिला विश्वकप्‌मा इंग्ल्याण्ड्‌ले बंगलादेश्‌लाई हरायो।
सात ठाउँमा पहिरो गएर दरखान जाने अलपत्रमा परे।,सात् ठाउँमा पहिरो गएर दर्‌खान् जाने अलपत्रमा परे।
मंगलबार बिहानदेखि अवरुद्ध भएको छ ।,मंगल्‌बार् बिहान्‌देखि अवरुद्ध् भएको छ ।
पहिरो खसेपछि यातायात सेवा अवरुद्ध भएको छ ।,पहिरो खसेपछि यातायात् सेवा अवरुद्ध् भएको छ ।
पानी परिरहेकाले पहिरो पन्छाउन नसकिएको प्रहरीले जनाएको छ ।,पानी परिरहेकाले पहिरो पन्छाउन नसकिएको प्रहरीले जनाएको छ ।
सडक अवरुद्धसँगै यात्रु अलपत्र परेका छन् ।,सडक् अवरुद्धसँगै यात्रु अलपत्र परेका छन् ।
पहिरो हटाएर बाटो सञ्चालन हुन मंगलबार दिनभर लाग्ने जनाइएको छ ।,पहिरो हटाएर बाटो सञ्चालन् हुन मंगल्‌बार् दिन्‌भर् लाग्ने जनाइएको छ ।
त्यत्तिबेला धेरै पढे लेखेका मानिसहरु पनि थिएनन् ।,त्यत्तिबेला धेरै पढे लेखेका मानिस्‌हरु पनि थिएनन् ।
तर मैले केही रोजगार पाईंन ।,तर मैले केही रोज्‌गार् पाईंन ।
कामका लागि भारत जाने बिगतकै परिपाटीलाई मैले पनि अँगालें ।,काम्‌का लागि भारत् जाने बिगत्‌कै परिपाटीलाई मैले पनि अँगालें ।
भारतमा काम गरेको केही रकम घरमा पठाउने गर्थे ।,भारत्‌मा काम् गरेको केही रकम् घर्‌मा पठाउने गर्थे ।
मैले त्यही बेला रक्सी पिउन पनि सिकें ।,मैले त्यही बेला रक्सी पिउन पनि सिकें ।
घरमा नगएको लामो समय भैसकेको थियो ।,घर्‌मा नगएको लामो समय् भैसकेको थियो ।
भारतमै हुँदा शारीरिक रुपमा एकदम कमजोर भएको महसुस भयो ।,भारत्‌मै हुँदा शारीरिक् रुप्‌मा एक्‌दम् कम्‌जोर् भएको महसुस् भयो ।
टाउको निक्कै दुखेपछि चेकअप गराउन एउटा अस्पतालमा गएँ ।,टाउको निक्कै दुखेपछि चेक्‌अप् गराउन एउटा अस्पताल्‌मा गएँ ।
त्यहाँ रगत परीक्षण गर्दा एचआइभी भएको डाक्टरले पुष्टि गरे।,त्यहाँ रगत् परीक्षण् गर्दा एच्‌आइभी भएको डाक्टर्‌ले पुष्टि गरे।
मलाई सुरुमा संसार आएर थिचेजस्तो महसुस भयो ।,मलाई सुरुमा संसार् आएर थिचेजस्तो महसुस् भयो ।
तर बिस्तारै सम्हालिदै गएँ ।,तर बिस्तारै सम्हालिदै गएँ ।
घर फर्किन पनि मन लागेन ।,घर् फर्किन पनि मन् लागेन ।
तर श्रीमती र छोरीहरुले पटक पटक खबर पठाएपछि म घरमा आएँ ।,तर श्रीमती र छोरीहरुले पटक् पटक् खबर् पठाएपछि म घर्‌मा आएँ ।
बिस्तारै गाउँलेलाई पनि थाहा भयो ।,बिस्तारै गाउँलेलाई पनि थाहा भयो ।
तर गाउँमा बस्न सक्ने अवस्था रहेन ।,तर गाउँमा बस्न सक्ने अवस्था रहेन ।
सबैले खड्काको कुरा काट्न थालेका थिए ।,सबैले खड्काको कुरा काट्न थालेका थिए ।
परिवारले पनि दुर्व्यवहार भोग्नुपरेको भन्दै भारत फर्कनुभयो ।,परिवार्‌ले पनि दुर्व्यवहार् भोग्नुपरेको भन्दै भारत् फर्कनुभयो ।
पछि घरपरिवारले र समाजले पनि बोलाएपछि उहाँ गाउँ फर्कनुभयो ।,पछि घर्‌परिवार्‌ले र समाज्‌ले पनि बोलाएपछि उहाँ गाउँ फर्कनुभयो ।
उहाँ अहिले सिलाई व्यवसाय थालेर जिविकोपार्जन गर्दै आउनुभएको छ ।,उहाँ अहिले सिलाई व्यवसाय् थालेर जिविकोपार्जन् गर्दै आउनुभएको छ ।
श्रीमती र आमाको लालनपालन गर्दै आउनुभएको छ ।,श्रीमती र आमाको लालन्‌पालन् गर्दै आउनुभएको छ ।
दोस्रो किस्तामा अझै सहमति हुन सकेको छैन।,दोस्रो किस्तामा अझै सहमति हुन सकेको छैन।
भूकम्प प्रभावित धमाधम घर बनाउँदैछन् ।,भूकम्प् प्रभावित् धमाधम् घर् बनाउँदैछन् ।
एकातिर घर बनाउने सरसामग्रीकै जोहो गर्न कठिन छ ।,एकातिर घर् बनाउने सर्‌सामग्रीकै जोहो गर्न कठिन् छ ।
उनीहरुको घर बनाउने लागत समेत बढ्ने भएको छ ।,उनीहरुको घर् बनाउने लागत् समेत् बढ्ने भएको छ ।
विकास योजनाको ठोस ढाँचा तयार गर्ने भएको हो।,विकास् योजनाको ठोस् ढाँचा तयार् गर्ने भएको हो।
काठमाडौं उपत्यकाका खुला ठाउँमा आगो बाल्न नपाइने घोषणा भएको छ।,काठ्‌माडौं उपत्यकाका खुला ठाउँमा आगो बाल्न नपाइने घोषणा भएको छ।
त्यति बेला बालिकाको मुटुको धड्कन लगभग रोकिने अवस्थामा पुगेको थियो ।,त्यति बेला बालिकाको मुटुको धड्कनd लग्‌भग् रोकिने अवस्थामा पुगेको थियो ।
"तथापी, चिकित्सकहरुले उनलाई बचाएर ट्यूमर निकाल्न सफल भए ।","तथापी, चिकित्सक्‌हरुले उन्‌लाई बचाएर ट्यूमर् निकाल्न सफल् भए ।"
उनको जन्म भएको आठ दिन पश्चात्त अर्को ठूलो शल्यक्रिया गरिएको थियो ।,उन्‌को जन्म भएको आठ् दिन् पश्चात्त् अर्को ठूलो शल्यक्रिया गरिएको थियो ।
हाल उनको अवस्था सामान्य रहेको चिकित्सकहरुले बताएका छन् ।,हाल् उन्‌को अवस्था सामान्य रहेको चिकित्सक्‌हरुले बताएका छन् ।
उनी यस दुनियामा ‘दुई पटक जन्म लिने’ पहिलो बालिका बनेकी छिन् ।,उनी यस् दुनियामा ‘दुई पटक् जन्म लिने’ पहिलो बालिका बनेकी छिन् ।
उनले थुप्रै भवनको आर्किटेक्ट पनि गरेका थिए।,उन्‌ले थुप्रै भवन्‌को आर्किटेक्ट् पनि गरेका थिए।
तर अब त्यसो गर्न नपाइने भएको छ ।,तर अब त्यसो गर्न नपाइने भएको छ ।
‘वर्षमा सय रुपैयाँ खर्च गरे मिर्गौलाको समस्याबाट बच्न सकिन्छ।,‘वर्षमा सय् रुपैयाँ खर्च गरे मिर्गौलाको समस्याबाट बच्न सकिन्छ।
अस्ट्रेलियाको सबैभन्दा गरिब गाउँको कथा !,अस्ट्रेलियाको सबैभन्दा गरिब् गाउँको कथा !
यो गाउँले धेरै समस्याहरुबाट गुज्रिनु पर्यो ।,यो गाउँले धेरै समस्याहरुबाट गुज्रिनु पर्यो ।
यसपश्चात यस गाउँले धेरै वर्षसम्म खडेरी पर्यो ।,यस्‌पश्चात् यस् गाउँले धेरै वर्षसम्म खडेरी पर्यो ।
स्थानीय मानिसहरुमा भएको जुन उत्साहा छ मैले अन्त कतै देखेको छैन ।’,स्थानीय मानिस्‌हरुमा भएको जुन् उत्साहा छ मैले अन्त कतै देखेको छैन ।’
मिलमा काम गर्ने कामदारहरुलाई सबैभन्दा कम ज्याला दिने गरिन्छ ।,मिल्‌मा काम् गर्ने काम्‌दार्‌हरुलाई सबैभन्दा कम् ज्याला दिने गरिन्छ ।
पदक्रमका अनुसार उनीहरु सबैभन्दा तलका उपभोगकर्ता हुन् ।,पद्‌क्रम्‌का अनुसार् उनीहरु सबैभन्दा तल्‌का उपभोग्‌कर्ता हुन् ।
धेरै मानिसलाई रोजगारी दिने समिल नै मुंगललालाको एकमात्र ठुलो मिल हो ।,धेरै मानिस्‌लाई रोज्‌गारी दिने एक्‌मात्र मिल् हो ।
समाजिक जीवन पनि उत्तिकै रमाइलो छ ।,समाजिक् जीवन् पनि उत्तिकै रमाइलो छ ।
यहाँ एकता छ ।,यहाँ एक्‌ता छ ।
उनलाई पनि यो ठाउँको अत्यन्त माया लाग्न थालेको छ ।,उन्‌लाई पनि यो ठाउँको अत्यन्त माया लाग्न थालेको छ ।
त्यो हाल सम्म पनि रहेको छ ।,त्यो हाल् सम्म पनि रहेको छ ।
गरिबीसँग मानिसहरु मिलेर जुध्ने गरेका छन् ।,गरिबीसँग मानिस्‌हरु मिलेर जुध्ने गरेका छन् ।
त्यही भएर पनि यहाँ गरिबी समस्या रहेको छैन ।’,त्यही भएर पनि यहाँ गरिबी समस्या रहेको छैन ।’
धेरै मानिसहरु काम पाएका छैनन् ।,धेरै मानिस्‌हरु काम् पाएका छैनन् ।
त्यसै कारण उनीहरु यसठाउँबाट अन्त काम गर्न जाने गरेका छन् ।,त्यसै कारण् उनीहरु यस्‌ठाउँबाट अन्त काम् गर्न जाने गरेका छन् ।
"सुनको मूल्य स्थिर, चाँदीको भने बढ्यो।","सुन्‌को मूल्य स्थिर्, चाँदीको भने बढ्यो।"
बुधबार सुनको मूल्य स्थिर रहेको छ ।,बुधबार् सुन्‌को मूल्य स्थिर् रहेको छ ।
राशीअनुसार कोसँग बिहे गर्ने र कोसँग नगर्ने ?,राशीअनुसार् कोसँग बिहे गर्ने र कोसँग नगर्ने ?
जुन कुनै महिलाको लागि निकै अमूल्य र महत्वपूर्ण चीज हो ।,जुन् कुनै महिलाको लागि निकै अमूल्य र महत्वपूर्ण चीज् हो ।
कुनै पनि नारी आफ्नो कुमारीत्वको विषयमा कमजोर हुँदैनन् ।,कुनै पनि नारी आफ्नो कुमारीत्वको विषय्‌मा कम्‌जोर् हुँदैनन् ।
विवाह साँच्चै नै एउटा ठूलो फैसला हो ।,विवाह् साँच्चै नै एउटा ठूलो फैसला हो ।
यो कुनै सानो कुरा होइन ।,यो कुनै सानो कुरा होइन ।
मानिसहरुले आजको समयमा विवाहलाई आधुनिक तरिकाले लिन्छन्।,मानिस्‌हरुले आजको समय्‌मा विवाह्‌लाई आधुनिक् तरिकाले लिन्छन्।
बिहे नभएसम्म कसैको असली स्वभाव थाहा पाउन सकिँदैन।,बिहे नभएसम्म कसैको असली स्वभाव् थाहा पाउन सकिँदैन।
उनले सरकारको प्रतिनिधि फिल्डमा नखटिदा समस्या आएको धारणा राखे ।,उन्‌ले सर्‌कार्‌को प्रतिनिधि फिल्डमा नखटिदा समस्या आएको धारणा राखे ।
बर्खाकै मुखमा नयाँ घर पाएपछि पिडितहरु निकै खुसी छन् ।,बर्खाकै मुख्‌मा नयाँ घर् पाएपछि पिडित्‌हरु निकै खुसी छन् ।
सुरक्षित घर पाएपछि त्यस क्षेत्रका पिडित दंङ्ग छन् ।,सुरक्षित् घर् पाएपछि त्यस् क्षेत्रका पिडित् दंङ्ग छन् ।
वर्षा अगावै सबै पीडितलाई स्थायी घरमा बसाउने योजना रहेको छ ।,वर्षा अगावै सबै पीडित्‌लाई स्थायी घर्‌मा बसाउने योजना रहेको छ ।
भवन निर्माणका लागि सहयोग गर्ने घोषणा भएको छ।,भवन् निर्माण्‌का लागि सहयोग् गर्ने घोषणा भएको छ।
यो घटना सञ्चार माध्यमबाट सार्वजनिक भएको हो ।,यो घट्‌ना सञ्चार् माध्यम्‌बाट सार्वजनिक् भएको हो ।
पीडित आग्रीले घटना मिलिसकेको भन्दै उजुरी दिन मानेनन् ।,पीडित् आग्रीले घट्‌ना मिलिसकेको भन्दै उजुरी दिन मानेनन् ।
प्रहरीले उजुरी नगरे उल्टै आग्रीलाई कारबाही गर्ने भनेर तर्साए ।,प्रहरीले उजुरी नगरे उल्टै आग्रीलाई कार्‌बाही गर्ने भनेर तर्साए ।
त्यसपछि बल्ल उजुरी दर्ता गरे ।,त्यसपछि बल्ल उजुरी दर्ता गरे ।
