input,output
"साँझमा एक घण्टा उसले बाँसुरी बजायो, अनि उ मनमा विविध कुराहरू खेलाउँदै बस्यो ।","साँझमा एक् घण्टा उस्‌ले बाँसुरी बजायो, अनि उ मन्‌मा विविध कुराहरू खेलाउँदै बस्यो ।"
"मोहन पढ्‌दै थियो, उसको छेउमा बसेर उसलाई सिकाइदियो।","मोहन् पढ्‌दै थियो, उस्‌को छेउमा बसेर उस्‌लाई सिकाइदियो।"
आधा रात बितेपछि ती दुईले निन्द्रादेवीको काखमा शरण लिए।,आधा रात् बितेपछि ती दुईले निन्द्रादेवीको काख्‌मा शरण् लिए।
बिहान उठ्नसाथ हात मुख धोएर ब्रस लियो अनि दाँत माझ्दै उ हानियो खोलातिर।,बिहान् उठ्न्‌साथ् हात् मुख् धोएर ब्रस् लियो अनि दाँत् माझ्दै उ हानियो खोलातिर।
कुन अज्ञात शक्‍तिले उसलाई त्यसरी खोलातिर तान्दै थियो कुन्नि उसलाई पनि थाहा थिएन।,कुन् अज्ञात् शक्‍तिले उस्‌लाई त्यसरी खोलातिर तान्दै थियो कुन्नि उस्‌लाई पनि थाहा थिएन।
"त्यस अन्धी रमामा उसले के भेट्‍टायो, उसका आँखा रमाको दर्शनार्थ लालायित भइरहेको थिए।","त्यस् अन्धी रमामा उस्‌ले के भेट्‍टायो, उस्‌का आँखा रमाको दर्शनार्थ लालायित् भइरहेको थिए।"
हृदयमा उत्कट अभिलाषा जागेर आयो।,हृदय्‌मा उत्कट् अभिलाषा जागेर आयो।
रमाको समीप पुग्नेनको इच्छा दबाउन नसकेरै त उ त्यसरी हानिएको त खोलातिर।,रमाको समीप् पुग्नेनको इच्छा दबाउन नसकेरै त उ त्यसरी हानिएको त खोलातिर।
खोलाको तटमा पुग्नसाथ त्यहाँ ढुङ्‍गामाथि टोलाएर बसिरेहकी त्यो किशोरीलाई सम्बोधन गर्‍यो उसले।,खोलाको तट्मा पुग्नसाथ् त्यहाँ ढुङ्‍गामाथि टोलाएर बसिरेहकी त्यो किशोरीलाई सम्बोधन् गर्‍यो उस्‌ले।
कसरी चिन्‍नुभयो?,कसरी चिन्‍नुभयो?
म एकपल्ट सुनेको स्वर फेरि सुने भने ठम्याउनसक्छु।,म एक्‌पल्ट सुनेको स्वर् फेरि सुने भने ठम्याउनसक्छु।
तपाईँको स्वर त झन् हिजै मात्र सुनेको किन ठम्याउन नसक्नु?,तपाईँको स्वर् त झन् हिजै मात्र सुनेको किन ठम्याउन नसक्नु?
यहाँ कतिखेर आउनु भएको?,यहाँ कतिखेर आउनु भएको?
के तपाईँ दाँतमा ब्रस लगाउँदै हुनुहुन्छ हो?,के तपाईँ दाँत्‌मा ब्रस् लगाउँदै हुनुहुन्छ हो?
हो कसरी थाहा भयो?,हो कसरी थाहा भयो?
आवाजबाटै थाहा भयो?,आवाज्‌बाटै थाहा भयो?
आवाजबाटै थाहा पाउँछु साना साना कुरा।,आवाज्‌बाटै थाहा पाउँछु साना साना कुरा।
बिहानै साह्रै चाँडो उठ्नु हुँदोरहेछ नि।,बिहानै साह्रै चाँडो उठ्नु हुँदोरहेछ नि।
अँ सकभर चाँडै उठ्ने प्रयास गर्दछु।,अँ सक्‌भर् चाँडै उठ्ने प्रयास् गर्दछु।
एउटा कुरा सोधुँ त तपाईँलाई?,एउटा कुरा सोधुँ त तपाईँलाई?
सोध्नुस् न के हो?,सोध्नुस् न के हो?
तपाईँ त्यसरी विरहलाग्दो भाकामा किन आधा रातसम्म बाँसुरी बजाउनुहुन्छ?,तपाईँ त्यसरी विरहलाग्दो भाकामा किन आधा रात्‌सम्म बाँसुरी बजाउनुहुन्छ?
मेरो दुखदायी अतीतलाई भुल्न म बाँसुरी बजाउँछु।,मेरो दुखदायी अतीत्‌लाई भुल्न म बाँसुरी बजाउँछु।
यो नयाँ ठाउँमा मेरो मनको वह पोख्ने आत्मीय साथी यै एउटा बाँसुरी त छ।,यो नयाँ ठाउँमा मेरो मन्‌को वह पोख्ने आत्मीय साथी यै एउटा बाँसुरी त छ।
स्कुलमा तपाईँले कुनै आत्मीय साथी पाउनु भएन र?,स्कुल्‌मा तपाईँले कुनै आत्मीय साथी पाउनु भएन र?
साथीहरू थुप्रै छन् थोरै समयमा कसरी आत्मीयता थाहा पाउन सकिन्छ र?,साथीहरू थुप्रै छन् थोरै समय्‌ म कसरी आत्मीयता थाहा पाउन सकिन्छ र?
मलाई यो सिनामफेदी गाउँ असाध्यै मन परेको छ।,मलाई यो सिनाम्‌फेदी गाउँ असाध्यै मन् परेको छ।
सधैँ सधैँ म यो गाउँमा रमाउन चाहन्छु।,सधैँ सधैँ म यो गाउँमा रमाउन चाहन्छु।
रमा केही बोलिन।,रमा केही बोलिन।
ऊ चुपचाप केही सोचिरहेकी थिई।,ऊ चुप्‌चाप् केही सोचिरहेकी थिई।
तपाईँको आँखा के भएर यस्तो भयो?,तपाईँको आँखा के भएर यस्तो भयो?
कि जन्मै अन्धा थिए तपाईँका आँखाहरू?,कि जन्मै अन्धा थिए तपाईँका आँखाहरू?
के भएर अन्धी भएँ त्यसको लामो इतिहास छ।,के भएर अन्धी भएँ त्यस्‌को लामो इतिहास् छ।
म जन्मँदै अन्धी हैन।,म जन्मँदै अन्धी हैन।
पहिले म त्यै स्कुलमा पढ्थेँ।,पहिले म त्यै स्कुल्‌मा पढ्थेँ।
तीन कक्षासम्म मात्र पढ्न पाएँ त्यसपछि मेरो जीवनमा अन्धकारले छोप्यो।,तीन् कक्षासम्म मात्र पढ्न पाएँ त्यस्‌पछि मेरो जीवन्‌मा अन्धकार्‌ले छोप्यो।
म अन्धी भएँ संसार मेरो लागि अँध्यारो भयो।,म अन्धी भएँ संसार् मेरो लागि अँध्यारो भयो।
एक दिन स्कुल विदा थियो।,एक् दिन् स्कुल् विदा थियो।
सायद त्यस दिन कुनै पर्व नै थियो।,सायद् त्यस् दिन् कुनै पर्व नै थियो।
त्यसै बेला रमा र ललित आइपुगे उसको सामुन्‍ने उभिनु।,त्यसै बेला रमा र ललित् आइपुगे उस्‌को सामुन्‍ने उभिनु।
त्यसै त्यसै उ मोहित भयो रमाको रूप र यौवनमा।,त्यसै त्यसै उ मोहित् भयो रमाको रूप् र यौवन्‌मा।
साँच्‍चै भगवान्‌ले उसको आँखाको मूल्यभन्दा पनि बढी मोलको रूप र लावण्य दिन चै कति पनि हिच्किचाएनछन्।,साँच्‍चै भगवान्‌ले उस्‌को आँखाको मूल्यभन्दा पनि बढी मोल्‌को रूप् र लावण्य दिन चै कति पनि हिच्किचाएनछन्।
यो रमाको मायालु वचन सुन्यो उसले।,यो रमाको मायालु वचन् सुन्यो उस्‌ले।
त्यो सिनामफेदी गाउँको त्यो अपार प्राकृतिक सुन्दरतामा कमलको मनभित्र सृजिएको प्रेमको मधुमय पराग छरियो वरिपरि।,त्यो सिनाम्‌फेदी गाउँको त्यो अपार् प्राकृतिक् सुन्दर्‌तामा कमल्‌को मन्‌भित्र सृजिएको प्रेम्‌को मधुमय् पराग् छरियो वरिपरि।
त्यो शून्य र सुन्दर फाँटमा प्रकृतिको मनोरम बहार सृजिदियो त्यो स्वर्णिम वातावरणलाई उजिल्याएर।,त्यो शून्य र सुन्दर् फाँट्‌मा प्रकृतिको मनोरम् बहार् सृजिदियो त्यो स्वर्णिम् वातावरण्‌लाई उजिल्याएर।
आँखा नदेख्ने भएर बाँच्नु साह्रै कठिन पर्दो रहेछ।,आँखा नदेख्ने भएर बाँच्नु साह्रै कठिन् पर्दो रहेछ।
त्यसमा पनि घरको दयनीय अवस्थाले सँधै रुवाउँछ मलाई।,त्यस्‌मा पनि घर्‌को दयनीय अवस्थाले सँधै रुवाउँछ मलाई।
आँसुका नुनिला ढिका पिएर यतिन्जेल बिताए।,आँसुका नुनिला ढिका पिएर यतिन्जेल् बिताए।
अब त यस्तो लाग्छ यो दुखको सागरमै डुबेर मेरो अन्त्य हुन्छ होला।,अब त यस्तो लाग्छ यो दुख्‌को सागर्‌मै डुबेर मेरो अन्त्य हुन्छ होला।
कमलले रमालाई सम्झाउन छाडेन।,कमल्‌ले रमालाई सम्झाउन छाडेन।
"यी त नितान्त आफ्ना पेवा हुन्, जन्मँदै प्रकृतिले दिएको अनुपम दान हो।","यी त नितान्त आफ्ना पेवा हुन्, जन्मँदै प्रकृतिले दिएको अनुपम् दान् हो।"
अनि मात्रै हामीले यो दुखको वृहत् महासागरबाट मुक्‍ति पाउनसक्छौ।,अनि मात्रै हामीले यो दुख्‌को वृहत् महासागर्‌बाट मुक्‍ति पाउनसक्छौ।
निराशामा नडुब।,निराशामा नडुब।
रमाइला कलकलाउँदा आशा र अभिलाषाका कलिला मुनाको मुन्टो ननिमोठ।,रमाइला कल्‌कलाउँदा आशा र अभिलाषाका कलिला मुनाको मुन्टो ननिमोठ।
"त्यसलाई फुल्न देऊ, झ्याँगिन देऊ, फैलन देऊ।","त्यस्‌लाई फुल्न देऊ, झ्याँगिन देऊ, फैलन देऊ।"
"दुखसँग सम्झौता गरेर, रमाएर बाँच्न सिक, आँखाबाट व्यर्थमा आँसु झर्नु नदेऊ,।","दुखसँग सम्झौता गरेर, रमाएर बाँच्न सिक, आँखाबाट व्यर्थमा आँसु झर्नु नदेऊ,।"
संसारको रित नै यस्तै रहेछ भनेर मन बुझाऊ।,संसार्‌को रित् नै यस्तै रहेछ भनेर मन् बुझाऊ।
डबडबाएर आँखाको डिलबाट पोखिन-पोखिन खोज्यो।,डब्‌डबाएर आँखाको डिल्‌बाट पोखिन-पोखिन खोज्यो।
सायद उसले रोक्ने प्रयास पनि गरिहोला तर रोकिएन।,सायद् उस्‌ले रोक्ने प्रयास् पनि गरिहोला तर रोकिएन।
सङ्‍लो पानी जस्तो आँसुको ठुल्‍ठुला थोपा गुडुल्किँदै झरे अनि गालामा अडिएन मोतीको दाना झैँ टल्कन थाले।,सङ्‍लो पानी जस्तो आँसुको ठुल्‍ठुला थोपा गुडुल्किँदै झरे अनि गालामा अडिएन मोतीको दाना झैँ टल्कन थाले।
अव्यक्‍त विषाद पोत्यो त्यो चम्किलो दिव्य मुहारमा।,अव्यक्‍त विषाद् पोत्यो त्यो चम्किलो दिव्य मुहार्‌मा।
कुन अज्ञात भयले रोकियो उसको हात।,कुन् अज्ञात् भय्‌ले रोकियो उस्‌को हात्।
सायद समाजको शङ्‍कालु नजरसँग डराएथ्यो होला ऊ।,सायद् समाज्‌को शङ्‍कालु नजर्‌सँग डराएथ्यो होला ऊ।
उठिसकेको हातलाई डर र त्रासको तारले बाँधिदियो।,उठिसकेको हात्‌लाई डर् र त्रास्‌को तार्‌ले बाँधिदियो।
त्यो हात फर्काएर नाडीमा बाँधेको घडी हेर्‍यो सात बज्दैथियो।,त्यो हात् फर्काएर नाडीमा बाँधेको घडी हेर्‍यो सात् बज्दैथियो।
मोहन चिया पिउनु पर्खिरहेको होला भन्‍ने सम्झेर उ उठ्यो र बोल्यो?,मोहन् चिया पिउनु पर्खिरहेको होला भन्‍ने सम्झेर उ उठ्यो र बोल्यो?
मोहन चिया तयार गरेर हामीलाई पर्खिरहेको होला।,मोहन् चिया तयार् गरेर हामीलाई पर्खिरहेको होला।
म फेरि पनि भन्छु यो जिन्दगीलाई हजार रङ सम्झेर मन नदुखाऊ।,म फेरि पनि भन्छु यो जिन्दगीलाई हजार् रङ् सम्झेर मन् नदुखाऊ।
यो संसारको यस्तो दयनीय रूप हेर्नुभन्दा त नहेर्न नै जाती छ।,यो संसार्‌को यस्तो दयनीय रूप् हेर्नुभन्दा त नहेर्न नै जाती छ।
दुवै उठेर कमलको वासस्थानतिर लागे।,दुवै उठेर कमल्‌को वास्‌स्थान्‌तिर लागे।
रमा सुस्तरी-सुस्तरी हिड्दैथिई कमलले निर्देशन गरेको बाटोमा।,रमा सुस्तरी-सुस्तरी हिड्दैथिई कमल्‌ले निर्देशन् गरेको बाटोमा।
"अपराह्नको समय, शनिवारको दिन परेकोले ललित स्कुल गएको थिएन।","अपराह्नको समय्, शनिवार्‌को दिन् परेकोले ललित् स्कुल् गएको थिएन।"
त्यसैले घरभित्र कोठामा ललित र रमा गफ गरेर बसिरहेका थिए।,त्यसैले घरभित्र कोठामा ललित् र रमा गफ् गरेर बसिरहेका थिए।
आमा चै गाउँतिर कता गएकी थिइन्।,आमा चै गाउँतिर कता गएकी थिइन्।
बाबु त सधैँ झैँ बिहानै निस्किएर खेततिर लागिसकेका थिए।,बाबु त सधैँ झैँ बिहानै निस्किएर खेत्‌तिर लागिसकेका थिए।
"घरमा आमाको अनुपस्थिति भएकै बेलामात्र रमा ललितसँग गफ गर्छे, खेल्छे र मायाले चुम्दै उसलाई अँगाल्छे।","घर्‌मा आमाको अनुपस्थिति भएकै बेलामात्र रमा ललित्‌सँग गफ् गर्छे, खेल्छे र मायाले चुम्दै उस्‌लाई अँगाल्छे।"
आमाचाहिँले‌ देखिन् भने उसलाई गाली गर्छिन्।,आमाचाहिँले‌ देखिन् भने उस्‌लाई गाली गर्छिन्।
आमा नभएका मौकामा ऊ भाइसँग प्रेमपूर्ण बात मारिरहेकी थिई।,आमा नभएका मौकामा ऊ भाइसँग प्रेम्‌पूर्ण बात् मारिरहेकी थिई।
तर आमाचाहिँ थाहा नै नपाई घरभित्र पसिन्।,तर आमाचाहिँ थाहा नै नपाई घर्‌भित्र पसिन्।
"काम छैन, काज छैन खाने बेलामा लाज छैन, बस्यो अनि गफ चुट्‌यो।","काम् छैन, काज् छैन खाने बेलामा लाज् छैन, बस्यो अनि गफ् चुट्‌यो।"
"आफू त बिग्रियो, बिग्रियो  त्यो भाइलाई पनि बिगार्न लागी छौँडीले।","आफू त बिग्रियो, बिग्रियो  त्यो भाइलाई पनि बिगार्न लागी छौँडीले।"
घरमा अलच्छिन पसेपछि यस्तै हो।,घर्‌मा अलच्छिन् पसेपछि यस्तै हो।
आमा चाहिँलाई टोकेरै मारी।,आमा चाहिँलाई टोकेरै मारी।
बाबुचाहिँ‌लाई वैरागी बनाई।,बाबुचाहिँ‌लाई वैरागी बनाई।
अब त्यो भाइलाई पनि के बनाउने हो।,अब त्यो भाइलाई पनि के बनाउने हो।
पढेर ठुलो मान्छे बन्छ भनेर डाहले भुतुक्‍क भएर अल्मल्याउन आइछे।,पढेर ठुलो मान्छे बन्छ भनेर डाहले भुतुक्‍क भएर अल्मल्याउन आइछे।
ऐ अन्धी तेरो यहाँ कुन नोकर छ हँ तँलाई बसाइ-बसाइ घाँटीसम्म आउन्ज्याल घिचाउने?,ऐ अन्धी तेरो यहाँ कुन् नोकर् छ हँ तँलाई बसाइ-बसाइ घाँटीसम्म आउन्ज्याल् घिचाउने?
खुरुक्‍क गएर थला सोर त।,खुरुक्‍क गएर थला सोर् त।
भर्खरै सोहोरेर आएकी।,भर्खरै सोहोरेर आएकी।
एकदम विनयको भावमा डराइ-डराइ बोली रमा।,एक्‌दम् विनय्‌को भाव्‌मा डराइ-डराइ बोली रमा।
"चोथाले, मुख फर्काउँछे।","चोथाले, मुख् फर्काउँछे।"
आफूभन्दा ठुलाले भनेपछि खुरुक्‍क गर्नपर्दैन?,आफूभन्दा ठुलाले भनेपछि खुरुक्‍क गर्नपर्दैन?
घर साँडा बन्छे बित्पाते।,घर् साँडा बन्छे बित्पाते।
"एउटा, आँखा फुटेको नाठो अन्मरिए पनि जोडी बाँधेर पठाइदिन्थे मेरो यहाँ रात दिनको बोझ त अलि हलुङ्‍गो हुन्थ्यो।","एउटा, आँखा फुटेको नाठो अन्मरिए पनि जोडी बाँधेर पठाइदिन्थे मेरो यहाँ रात् दिन्‌को बोझ् त अलि हलुङ्‍गो हुन्थ्यो।"
यै वेश्येले गर्दा बाबु चाहिँ वैरागिए।,यै वेश्येले गर्दा बाबु चाहिँ वैरागिए।
दिउँसो कहिल्यै घर बस्दैनन्।,दिउँसो कहिल्यै घर् बस्दैनन्।
आधा रातमा रक्सीले मात्तिएर आउँछन्।,आधा रात्‌मा रक्सीले मात्तिएर आउँछन्।
