input,output
आइतवार हप्ताको अन्तिम दिन हो।,आइतवार् हप्ताको अन्तिम् दिन् हो।
म लेख्न सक्दिन ।,म लेख्न सक्दिन ।
म हरेक दिन भात खान्छु।,म हरेक् दिन् भात् खान्छु।
म सामान्यतया दिनमा कम्तिमा दुई पटक भात खान्छु।,म सामान्यतया दिन्‌मा कम्तिमा दुई पटक् भात् खान्छु।
"मलाई भात मनपर्छ, तर म हरेक दिन खान्न।","मलाई भात् मन्‌पर्छ, तर म हरेक् दिन् खान्न।"
म यसलाई पर्याप्त जोड दिन सक्दिन।,म यसलाई पर्याप्त जोड् दिन सक्दिन।
के त्यो दिन साँच्चै के भयो भनेर कसैले तपाईलाई बताएको छ?,के त्यो दिन् साँच्चै के भयो भनेर कसैले तपाईलाई बताएको छ?
उपहारको लागि टमलाई धन्यवाद दिन सम्झनुहोस्।,उपहार्‌को लागि टम्‌लाई धन्यवाद् दिन सम्झनुहोस्।
"यदि मैले यसलाई प्रयोग गर्दिन भने, मैले यसलाई परोपकारमा दान गर्नुपर्छ ।","यदि मैले यस्‌लाई प्रयोग् गर्दिन भने, मैले यसलाई परोप्‌कार्‌मा दान् गर्नुपर्छ ।"
तिमी मलाई किन दुख दिन चाहान्छौ?,तिमी मलाई किन दुख दिन चाहान्छौ?
हामी हरेक दिन काठ काट्छौं।,हामी हरेक् दिन् काठ् काट्छौं।
जिरी दिनहुँ अध्ययन गर्छिन्।,जिरी दिनहुँ अध्ययन् गर्छिन्।
भोलि बुबाको मुख हेर्ने दिन हो।,भोलि बुबाको मुख् हेर्ने दिन् हो।
दिदिले आफ्नो बुबालाई त्यस दिन शुभकामना दिन फोन गरे।,दिदिले आफ्नो बुबालाई त्यस् दिन् शुभकामना दिन फोन गरे।
म गाईको मासु खाँदिन।,म गाईको मासु खाँदिन।
म माफी माग्ने धेरै मानिसहरूलाई चिन्दिन।,म माफी माग्ने धेरै मानिसहरूलाई चिन्दिन।
तपाईलाई ज्याज किन मन पर्दैन भन्ने कुरा म बुझ्न सक्दिन।,तपाईलाई ज्याज किन मन पर्दैन भन्ने कुरा म बुझ्न सक्दिन।
मैले दिनभरि निकै मेहनत गरेको छु ।,मैले दिन्‌भरि निकै मेहनत् गरेको छु ।
आजको दिन गजबको छ।,आजको दिन् गजब्‌को छ।
के तपाईं मलाई एउटा उदाहरण दिन सक्नुहुन्छ?,के तपाईं मलाई एउटा उदाहरण् दिन सक्नुहुन्छ?
तपाईंले ध्यान दिन आवश्यक छ।,तपाईंले ध्यान् दिन आवश्यक् छ।
म तिमीलाई दबाब दिन चाहन्न।,म तिमीलाई दबाब् दिन चाहन्न।
म हरेक दिन फुटबल खेल्छु।,म हरेक् दिन् फुटबल् खेल्छु।
ले मलाई केही पैसा उधारो दिन आग्रह गरेको छ।,टमले मलाई केही पैसा उधारो दिन आग्रह गरेको छ।
मलाई कष्ट दिन बन्द गर्नुहोस्।,मलाई कष्ट दिन बन्द गर्नुहोस्।
म प्रति दिन एक सय यूरो कमाउँछु।,म प्रति दिन् एक् सय् यूरो कमाउँछु।
म कातोजीको परिचय दिन चाहन्छु।,म कातोजीको परिचय दिन चाहन्छु।
त्यो प्रश्नको जवाफ दिन गाह्रो भयो।,त्यो प्रश्नको जवाफ् दिन गाह्रो भयो।
उनको हरेक दिन डायरी लेखेर राख्ने बानी छ।,उनको हरेक् दिन् डायरी लेखेर राख्ने बानी छ।
त्यहाँ राम्रो र सितल थियो।,त्यहाँ राम्रो र सितल् थियो।
पृथ्वी समतल छ!,पृथ्वी सम्‌तल् छ!
हामीले कति बोतल वाइन पियौं मलाई याद छैन।,हामीले कति बोतल् वाइन् पियौं मलाई याद् छैन।
मैदान पूर्ण रूपमा समतल छ।,मैदान् पूर्ण रूप्‌मा सम्‌तल् छ।
त्यो बोतलमा दूध छ।,त्यो बोतल्‌मा दूध् छ।
सितल मौसमले आज आनन्द आयो।,सितल् मौसम्‌ले आज आनन्द आयो।
उसले बोतल बलियोसंग समात्यो।,उस्‌ले बोतल् बलियोसंग समात्यो।
समतल क्षेत्रहरूमा नदीहरू बग्छन्।,सम्‌तल् क्षेत्रहरूमा नदीहरू बग्छन्।
सितलको भाषणले सबै श्रोता शान्त भए।,सितल्‌को भाषण्‌ले सबै श्रोता शान्त् भए।
ऊ बोतल बेच्ने पसलमा गयो।,ऊ बोतल् बेच्ने पसल्‌मा गयो।
झ्यालबाट तल हेर्दा मान्छेहरू देखिए।,झ्याल्‌बाट तल हेर्दा मान्छेहरू देखिए।
त्यो किताब टेबलको तल छ।,त्यो किताब् टेबल्‌को तल छ।
पल्लो कोठाबाट ऊ तल आयो।,पल्लो कोठाबाट ऊ तल आयो।
ऊ तल बसेर पढ्दै थियो।,ऊ तल बसेर पढ्दै थियो।
उनी तल गएर काम गर्दैछन्।,उनी तल गएर काम् गर्दैछन्।
ऊ तल सडकमा कुरिरहेको छ।,ऊ तल सडक्‌मा कुरिरहेको छ।
तपाईको तलको छिमेकी को हो?,तपाईको तलको छिमेकी को हो?
म ओछ्यानबाट हाम फालेर तल दगुरेँ।,म ओछ्यान्‌बाट हाम् फालेर तल दगुरेँ।
मैले तलब पाएको छैन।,मैले तलब् पाएको छैन।
तल जान माथि जानु भन्दा गाह्रो छ।,तल जान माथि जानु भन्दा गाह्रो छ।
मलाई नट्टो खान मन लाग्दैन तर खानु पर्छ।,मलाई नट्टो खान मन् लाग्दैन तर खानु पर्छ।
म धेरै ठाउँ घुम्न चाहन्छु तर मसँग पैसा छैन।,म धेरै ठाउँ घुम्न चाहन्छु तर मसँग पैसा छैन।
"साहस गरेर, खोला तर।","साहस् गरेर, खोला तर।"
टम म भन्दा कान्छो छ तर ऊ म भन्दा अग्लो छ।,टम् म भन्दा कान्छो छ तर ऊ म भन्दा अग्लो छ।
"कहिलेकाहीँ म लढे, तर मैले कहिल्यै हार मानिनँ।","कहिलेकाहीँ म लढे, तर मैले कहिल्यै हार् मानिनँ।"
"बाटो सकियो, अब खोला तर।","बाटो सकियो, अब खोला तर।"
यो तेल तरल अवस्थामा छ।,यो तेल् तरल् अवस्थामा छ।
"म तिमीलाई भेट्न चाहन्थेँ, तर म व्यस्त थिएँ।","म तिमीलाई भेट्न चाहन्थेँ, तर म व्यस्त थिएँ।"
"उसले पढ्ने निर्णय गर्‍यो, तर ध्यान दिन सकेन।","उस्‌ले पढ्ने निर्णय गर्‍यो, तर ध्यान् दिन सकेन।"
"म मुस्कुराएँ, तर मन दुःखी थियो।","म मुस्कुराएँ, तर मन् दुःखी थियो।"
उसले तातो तरकारी भान्सामा पकाइन्।,उस्‌ले तातो तर्‌कारी भान्सामा पकाइन्।
 मैले सबैभन्दा मन पर्ने तरकारी पालक हो।, मैले सबैभन्दा मन् पर्ने तर्‌कारी पालक् हो।
त्यो बिरालोले दूधको तर चाटिरहेको थियो।,त्यो बिरालोले दूध्‌को तर् चाटिरहेको थियो।
त्यसले दूधको सतहबाट तर हटायो।,त्यस्‌ले दूध्‌को सतहबाट तर् हटायो।
म भात तरकारी खान चाहन्छु।,म भात् तर्‌कारी खान चाहन्छु।
तर झिकेको दूध अझ फिक्का लाग्छ।,तर् झिकेको दूध् अझ फिक्का लाग्छ।
बिहानै उठेर उसले दूधको तर झिकिन् ।,बिहानै उठेर उस्‌ले दूध्‌को तर् झिकिन् ।
तर बटुलेर आमाले घ्यू बनाउन थाल्नुभयो।,तर् बटुलेर आमाले घ्यू बनाउन थाल्नुभयो।
दूधको सतहमा तर जम्न थाल्यो,दूध्‌को सतहमा तर् जम्न थाल्यो
दूधमा तर लागेपछि उसले त्यसलाई चिया बनाउन प्रयोग गर्‍यो।,दूध्‌मा तर् लागेपछि उस्‌ले त्यस्‌लाई चिया बनाउन प्रयोग् गर्‍यो।
"कर समयमा तिर, जरीवाना लाग्दैन।","कर् समय्‌मा तिर, जरीवाना लाग्दैन।"
अब बाँकी रकम तिर।,अब बाँकी रकम् तिर।
"पहिले भाडा तिर, अनि कोठा लिन पाउँछौ।","पहिले भाडा तिर, अनि कोठा लिन पाउँछौ।"
कृपया बिल तिर अनि जाउ ।,कृपया बिल तिर अनि जाउ ।
त्यो जरिवाना तुरुन्तै तिर।,त्यो जरिवाना तुरुन्तै तिर।
बाघ बस्ती तिर नआओस् भनेर पर्खाल बनाइएको छ।,बाघ बस्ती तिर नआओस् भनेर पर्खाल बनाइएको छ।
हामी पूर्व तिर लाग्यौं।,हामी पूर्व तिर लाग्यौं।
उसको ध्यान मोबाइल तिर थियो।,उस्‌को ध्यान् मोबाइल् तिर थियो।
ऊ घर तिर फर्कियो।,ऊ घर् तिर फर्कियो।
म सिधा अस्पताल तिर लागेँ।,म सिधा अस्पताल् तिर लागेँ।
उसले धनुषबाट तिर चलायो।,उस्‌ले धनुष्‌बाट तिर् चलायो।
शत्रुलाई तिर लागेर घाइते बनायो।,शत्रुलाई तिर् लागेर घाइते बनायो।
त्यो तिर सिधै निशानामा लाग्यो।,त्यो तिर् सिधै निशानामा लाग्यो।
शत्रुलाई तिर लागेर घाइते बनायो।,शत्रुलाई तिर् लागेर घाइते बनायो।
तिर सीधा लक्ष्यमा लाग्यो।,तिर् सीधा लक्ष्यमा लाग्यो।
यो तिर केवल युद्धको लागि प्रयोग हुन्थ्यो।,यो तिर् केवल् युद्धको लागि प्रयोग् हुन्थ्यो।
तिर चलाउँदा दायाँ हात बलियो हुनुपर्छ।,तिर् चलाउँदा दायाँ हात् बलियो हुनुपर्छ।
तिर एकदमै धारिलो थियो।,तिर् एक्‌दमै धारिलो थियो।
तिर चलाउने प्रतियोगिता आयोजना गरिएको छ।,तिर् चलाउने प्रतियोगिता आयोजना गरिएको छ।
सेनाले सयौँ तिर एकैपटक चलायो।,सेनाले सयौँ तिर् एकैपटक् चलायो।
माया र हर्षका साथ नयाँ अध्याय खोल।,माया र हर्षका साथ् नयाँ अध्याय् खोल।
झोला खोल अनि सामान बाहिर निकाल।,झोला खोल अनि सामान् बाहिर निकाल।
ढोका खोल। मलाई थाहा छ तिमी त्यहाँ छौ।,ढोका खोल। मलाई थाहा छ तिमी त्यहाँ छौ।
किताब खोल अनि पढ्न थाल।,किताब् खोल अनि पढ्न थाल।
खाम खोल अनि चिठी पढ।,खाम् खोल अनि चिठी पढ।
फ्रिज खोल अनि बोतल निकाल।,फ्रिज् खोल अनि बोतल् निकाल।
"गेट खोल, पाहुना आइपुगे।","गेट् खोल, पाहुना आइपुगे।"
फोन खोल अनि म्यासेज चेक गर।,फोन् खोल अनि म्यासेज् चेक् गर।
लिफा खोल ।,लिफा खोल ।
किताब खोल ।,किताब् खोल ।
नरिवलको खोल धेरै कडा हुन्छ।,नरिवल्‌को खोल् धेरै कडा हुन्छ।
त्यस फलको खोल चिल्लो र गुलियो छ।,त्यस् फल्‌को खोल् चिल्लो र गुलियो छ।
उसले चकलेटको खोल हटाएर खायो।,उस्‌ले चक्‌लेट्‌को खोल् हटाएर् खायो।
किताबहरूलाई खोलमा राखेपछि सुरक्षित रहन्छ।,किताब्‌हरूलाई खोल्‌मा राखेपछि सुरक्षित् रहन्छ।
यो तारको खोल प्लास्टिकको छ।,यो तार्‌को खोल् प्लास्टिक्‌को छ।
हरियो आँपको खोल अलिकति अमिलो हुन्छ।,हरियो आँप्‌को खोल् अलिकति अमिलो हुन्छ।
कछुवाको गाढा खोलमा प्रायजसो पहेँला थोप्लाहरू हुन्छन्।,कछुवाको गाढा खोल्‌मा प्रायजसो पहेँला थोप्लाहरू हुन्छन्।
यसमा कडा रातो बाहिरी खोल अनि भित्र थोरै चपाइन सकिने किसिमको हुन्छ।,यस्‌मा कडा रातो बाहिरी खोल् अनि भित्र थोरै चपाइन सकिने किसिम्‌को हुन्छ।
एक्स विन्डो प्रणाली ग्राफिकल इन्टरफेसको एउटा खोल मात्र हो।,एक्स् विन्डो प्रणाली ग्राफिकल् इन्टर्‌फेस्‌को एउटा खोल् मात्र हो।
"तिनीहरूसँग नरम, कहिलेकाहीँ तरल, भरिने कडा चकलेट खोल हुन्छ।","तिनीहरूसँग नरम्, कहिलेकाहीँ तरल्, भरिने कडा चक्‌लेट् खोल् हुन्छ।"
म थप योगदान गर्न चाहन्छु।,म थप् योग्‌दान् गर्न चाहन्छु।
हामीले थप मानिसहरूलाई आमन्त्रित गर्यौं।,हामीले थप् मानिस्‌हरूलाई आमन्त्रित् गर्यौं।
सामीले थप भिडियोहरू बनाएका छन्।,सामीले थप् भिडियोहरू बनाएका छन्।
तिमीले थप प्रयास गर्नुपर्छ।,तिमीले थप् प्रयास् गर्नुपर्छ।
उनीहरूले थप घरहरू निर्माण गरे।,उनीहरूले थप् घर्‌हरू निर्माण् गरे।
मैले थप जानकारी पाएँ।,मैले थप् जान्‌कारी पाएँ।
सरकारले थप योजना ल्यायो।,सर्‌कार्‌ले थप् योजना ल्यायो।
बजारमा थप सामानहरू आए।,बजार्‌मा थप् सामान्‌हरू आए।
शिक्षकले थप प्रश्नहरू सोध्नुभयो।,शिक्षक्‌ले थप् प्रश्नहरू सोध्नुभयो।
उसले थप अनुभव प्राप्त गर्यो।,उस्‌ले थप् अनुभव् प्राप्त गर्यो।
यस सूपमा नुन थप ।,यस् सूप्‌मा नुन् थप ।
तिम्रो भाषणमा केहि उदाहरण थप।,तिम्रो भाषण्‌मा केहि उदाहरण् थप।
खानामा अलिकति मसला थप।,खानामा अलिकति मसला थप।
यो लिस्टमा तिम्रो नाम थप।,यो लिस्टमा तिम्रो नाम् थप।
तस्बिरमा केहि रंग थप।,तस्बिर्‌मा केहि रंग् थप।
गीतमा नयाँ बोल थप।,गीतमा नयाँ बोल् थप।
नियममा केहि शर्त थप।,नियम्‌मा केहि शर्त थप।
मेकअपमा हाइलाइटर थप।,मेक्‌अप्‌मा हाइलाइटर् थप।
यस चियामा चिनी थप।,यस् चियामा चिनी थप।
यो झोलमा अलिकति पानी थप।,यो झोल्‌मा अलिकति पानी थप।
बस दिनमा कति पटक चल्छ?,बस् दिन्‌मा कति पटक् चल्छ?
म बस एउटा ट्याक्सी खोज्न चाहन्छु।,म बस् एउटा ट्याक्सी खोज्न चाहन्छु।
बस बाहिर नजानुहोस्।,बस् बाहिर नजानुहोस्।
यो बस बिसौनी हो।,यो बस् बिसौनी हो।
विद्यालय जान नियमित रूपमा बस प्रयोग गर्छु।,विद्यालय् जान नियमित् रूप्‌मा बस् प्रयोग् गर्छु।
बस भित्र धेरै यात्रु थिए।,बस् भित्र धेरै यात्रु थिए।
ट्राफिक जामका कारण बस ढिलो भयो।,ट्राफिक् जाम्‌का कारण् बस् ढिलो भयो।
उनले टिकट लिएर बस कुरे।,उन्‌ले टिकट् लिएर बस् कुरे।
त्यो बस दिउँसो ३ बजे छुट्छ।,त्यो बस् दिउँसो ३ बजे छुट्छ।
यो रातको अन्तिम बस हो।,यो रात्‌को अन्तिम् बस् हो।
"शिक्षकले भने — ""शान्त भएर बस।""","शिक्षक्‌ले भने — ""शान्त भएर बस।"""
"पर्ख, केही बेर मसँग बस।","पर्ख, केही बेर् मसँग बस।"
ओछ्यानमा बस।,ओछ्यान्‌मा बस।
झोला राख अनि  बस।,झोला राख अनि  बस।
अब चुपचाप बस।,अब चुप्‌चाप् बस।
कोठाको कुनामा बस।,कोठाको कुनामा बस।
"कुरामा ध्यान दिनु, यहाँ बस।","कुरामा ध्यान् दिनु, यहाँ बस।"
मेरो अगाडि बसेर काम गर।,मेरो अगाडि बसेर काम् गर।
तिमी कुर्सीमा बस।,तिमी कुर्सीमा बस।
ढोका बन्द गरेर बस।,ढोका बन्द् गरेर बस।
मलाई अण्डाको पहेलो भाग मन पर्छ।,मलाई अण्डाको पहेलो भाग् मन् पर्छ।
के तपाई बैठकमा भाग लिने योजनामा हुनुहुन्छ?,के तपाई बैठक्‌मा भाग् लिने योजनामा हुनुहुन्छ?
मलाई सहरको यो भाग राम्ररी थाहा छैन।,मलाई सहर्‌को यो भाग् राम्ररी थाहा छैन।
म समूहको एक भाग मात्र हुँ।,म समूहको एक् भाग् मात्र हुँ।
